{
  "Name": "CaseConverter",
  "Author": "Alacrity",
  "Version": "1.0.0",
  "Description": "Converts text to multiple cases",
  "Categories": ["Converter"],
  "MultiLanguage": true,
  "Locale": {
    "Name": {
      "en": "Case Converter",
      "zhHans": "大小写转换"
    },
    "Description": {
      "en": "Converts text to multiple cases.",
      "zhHans": "将文本转换为多种大小写格式。"
    }
  }
}
