{
  "Name": "AddLineNumber",
  "Author": "Alacrity",
  "Version": "1.0.0",
  "Description": "Add multiple kinds of line number.",
  "Categories": ["Converter"],
  "MultiLanguage": true,
  "Locale": {
    "Name": {
      "en": "Add Line Number",
      "zhHans": "添加行号"
    },
    "Description": {
      "en": "Add multiple kinds of line number.",
      "zhHans": "添加多种格式的行号。"
    }
  }
}
