{
  "Name": "Base64",
  "Author": "Alacrity",
  "Description": "A simple base64 encoder/decoder.",
  "Version": "1.0.0",
  "Categories": ["Encrypt"],
  "MultiLanguage": true,
  "Locale": {
    "Name": {
      "en": "Base64 Util",
      "zhHans": "Base64工具"
    },
    "Description": {
      "en": "A simple base64 encoder/decoder.",
      "zhHans": "Base64加密/解密工具。"
    }
  }
}
