{
  "Name": "CssUnit",
  "Author": "Alacrity",
  "Version": "1.0.0",
  "Description": "Css absolute and relative length units.",
  "Categories": ["CheatSheet"],
  "MultiLanguage": true,
  "Locale": {
    "Name": {
      "en": "Css Length Units",
      "zhHans": "Css长度单位"
    },
    "Description": {
      "en": "Css absolute and relative length units.",
      "zhHans": "Css绝对和相对长度单位"
    }
  }
}
