{
  "Name": "Timestamp",
  "Author": "Alacrity",
  "Version": "1.0.0",
  "Description": "Convert timestamps.",
  "Categories": ["Converter"],
  "MultiLanguage": true,
  "Locale": {
    "Name": {
      "en": "Timestamp Util",
      "zhHans": "时间戳工具"
    },
    "Description": {
      "en": "Convert timestamp to multiple formats.",
      "zhHans": "将时间戳转换为不同的格式。"
    }
  }
}
