{
  "Name": "UrlParse",
  "Author": "Alacrity",
  "Version": "1.0.0",
  "Description": "A tool for parsing URL.",
  "Categories": ["Parser"],
  "MultiLanguage": true,
  "Locale": {
    "Name": {
      "en": "URL Parse Util",
      "zhHans": "URL解析工具"
    },
    "Description": {
      "en": "Parsing url and viewing its parts.",
      "zhHans": "解析URL，查看URL的各个部分。"
    }
  }
}
