{
  "Name": "RsaKeyGen",
  "Author": "Alacrity",
  "Description": "Generate RSA key pairs.",
  "Version": "1.0.0",
  "Categories": ["Generator"],
  "MultiLanguage": true,
  "Locale": {
    "Name": {
      "en": "RSA Keygen",
      "zhHans": "RSA密钥生成"
    },
    "Description": {
      "en": "Generate RSA key pairs.",
      "zhHans": "生成RSA密钥对。"
    }
  }
}
