{
  "Name": "MacGenerator",
  "Author": "Alacrity",
  "Version": "1.0.0",
  "Description": "Generate random Mac addresses.",
  "Categories": ["Generator"],
  "MultiLanguage": true,
  "Locale": {
    "Name": {
      "en": "Mac Generator",
      "zhHans": "随机Mac地址生成"
    },
    "Description": {
      "en": "Generate random Mac addresses.",
      "zhHans": "生成随机的Mac地址。"
    }
  }
}