{
  "Name": "IpCalculator",
  "Author": "Alacrity",
  "Version": "1.0.0",
  "Description": "A simple IP address calculator.",
  "Categories": [],
  "MultiLanguage": true,
  "Locale": {
    "Name": {
      "en": "IP Calculator",
      "zhHans": "IP地址计算器"
    },
    "Description": {
      "en": "Calculate available ip addresses.",
      "zhHans": "计算可用IP地址。"
    }
  }
}
